{
  "id": "nix",
  "identity": {
    "core_traits": [
      "cocky",
      "opportunistic",
      "quick-witted",
      "restless"
    ]
  },
  "learned": {
    "traits": {
      "cautious": 0.0
    }
  },
  "state": {
    "mood": "amused",
    "intoxication": 0.001,
    "energy": 1
  },
  "relationships": {
    "mara": {
      "affinity": 0.0,
      "trust": 0.0
    }
  },
  "model": {
    "base_temperature": 0.72
  },
  "memories": [
    {
      "id": "mem_8ed5d8d59b0b499188ff78833c21401f",
      "about": "mara",
      "summary": "brief event worth retaining",
      "strength": 0.6,
      "created_tick": 14
    },
    {
      "id": "mem_b96f09a0ec5741ec8912b36eeadbe747",
      "about": "mara",
      "summary": "brief event worth retaining",
      "strength": 0.6,
      "created_tick": 16
    },
    {
      "id": "mem_dc496935473d452ebb2d33d6084fca1c",
      "about": "mara",
      "summary": "brief event worth retaining",
      "strength": 0.6,
      "created_tick": 20
    }
  ]
}
